{"protocol_version":"1.0","invocation_id":"INV-1","run_id":"RUN-1","attempt_id":"ATT-1","host_adapter":{"id":"opencode-node","adapter_version":"1.0.0","host_version":"1.18.10","sdk_version":"1.18.10"},"objective":"Return a structured handoff","context_manifest_ref":{"ref":"context/CTX-1.json","content_hash":"sha256:0000000000000000000000000000000000000000000000000000000000000000"},"rendered_messages":[{"role":"SYSTEM","content":"Follow the approved contract."},{"role":"USER","content":"Implement the slice."}],"output_contract":{"schema_id":"handoff","schema_version":"1.0.0","content_hash":"sha256:1111111111111111111111111111111111111111111111111111111111111111","validation_retry_limit":1},"created_at":"2026-08-05T10:00:00Z"}
